{
  "language": "en",
  "level": "B1",
  "topic": "Idioms & Expressions",
  "words": [
    {
      "word": "Piece of cake",
      "word_id": "en_idiom_piece_of_cake",
      "pos": "idiom",
      "definition": "Something that is very easy to do.",
      "example": "The English test was a piece of cake."
    },
    {
      "word": "Break a leg",
      "word_id": "en_idiom_break_a_leg",
      "pos": "idiom",
      "definition": "Good luck (wished to a performer before a show).",
      "example": "Break a leg at your concert tonight!"
    },
    {
      "word": "So far so good",
      "word_id": "en_idiom_so_far_so_good",
      "pos": "idiom",
      "definition": "Things have gone well up to now.",
      "example": "How is the new job? So far so good!"
    },
    {
      "word": "Time flies",
      "word_id": "en_idiom_time_flies",
      "pos": "idiom",
      "definition": "Time passes surprisingly quickly.",
      "example": "Time flies when you are having fun with friends."
    },
    {
      "word": "Easy come, easy go",
      "word_id": "en_idiom_easy_come_easy_go",
      "pos": "idiom",
      "definition": "Money or success easily gained is easily lost.",
      "example": "I lost my winnings, but easy come, easy go."
    },
    {
      "word": "Better late than never",
      "word_id": "en_idiom_better_late_than_never",
      "pos": "idiom",
      "definition": "It is better to do something late than not at all.",
      "example": "You finally arrived! Better late than never."
    },
    {
      "word": "Make up your mind",
      "word_id": "en_idiom_make_up_your_mind",
      "pos": "idiom",
      "definition": "To decide or make a decision.",
      "example": "Please make up your mind about which course to take."
    },
    {
      "word": "Keep in touch",
      "word_id": "en_idiom_keep_in_touch",
      "pos": "idiom",
      "definition": "To maintain contact with someone.",
      "example": "Let us keep in touch after the course ends."
    },
    {
      "word": "Day in, day out",
      "word_id": "en_idiom_day_in_day_out",
      "pos": "idiom",
      "definition": "Continuously; every single day.",
      "example": "He practiced guitar day in, day out to improve."
    },
    {
      "word": "All in all",
      "word_id": "en_idiom_all_in_all",
      "pos": "idiom",
      "definition": "Considering everything; overall.",
      "example": "All in all, the vacation was a great success."
    },
    {
      "word": "Safe and sound",
      "word_id": "en_idiom_safe_and_sound",
      "pos": "idiom",
      "definition": "Unarmed and free from danger.",
      "example": "They arrived home safe and sound after the long storm."
    },
    {
      "word": "First come, first served",
      "word_id": "en_idiom_first_come_first_served",
      "pos": "idiom",
      "definition": "People are served in the order of their arrival.",
      "example": "Tickets are allocated first come, first served."
    },
    {
      "word": "Give it a try",
      "word_id": "en_idiom_give_it_a_try",
      "pos": "idiom",
      "definition": "To attempt or try something.",
      "example": "Even if it looks difficult, give it a try."
    },
    {
      "word": "Cross your fingers",
      "word_id": "en_idiom_cross_your_fingers",
      "pos": "idiom",
      "definition": "To hope for good luck or a favorable outcome.",
      "example": "Cross your fingers that we win the game!"
    },
    {
      "word": "Long time no see",
      "word_id": "en_idiom_long_time_no_see",
      "pos": "idiom",
      "definition": "It has been a long time since we last met.",
      "example": "Long time no see! How have you been?"
    },
    {
      "word": "Make yourself at home",
      "word_id": "en_idiom_make_yourself_at_home",
      "pos": "idiom",
      "definition": "To feel comfortable and relaxed in someone else's home.",
      "example": "Please sit down and make yourself at home."
    },
    {
      "word": "Take it easy",
      "word_id": "en_idiom_take_it_easy",
      "pos": "idiom",
      "definition": "To relax and rest.",
      "example": "Take it easy this weekend after a busy week at work."
    },
    {
      "word": "As good as new",
      "word_id": "en_idiom_as_good_as_new",
      "pos": "idiom",
      "definition": "In very good condition, like new.",
      "example": "After repairs, the bicycle was as good as new."
    },
    {
      "word": "Take your time",
      "word_id": "en_idiom_take_your_time",
      "pos": "idiom",
      "definition": "Do not hurry; work at a comfortable pace.",
      "example": "Take your time answering the test questions."
    },
    {
      "word": "Sooner or later",
      "word_id": "en_idiom_sooner_or_later",
      "pos": "idiom",
      "definition": "Eventually; at some point in the future.",
      "example": "Sooner or later, you will master English grammar."
    },
    {
      "word": "Over and over",
      "word_id": "en_idiom_over_and_over",
      "pos": "idiom",
      "definition": "Repeatedly many times.",
      "example": "Example sentence using 'Over and over'."
    },
    {
      "word": "Here and there",
      "word_id": "en_idiom_here_and_there",
      "pos": "idiom",
      "definition": "Idiomatic expression: 'Here and there'",
      "example": "Example sentence using 'Here and there'."
    },
    {
      "word": "A big deal",
      "word_id": "en_idiom_a_big_deal",
      "pos": "idiom",
      "definition": "Idiomatic expression: 'A big deal'",
      "example": "Example sentence using 'A big deal'."
    },
    {
      "word": "A change of mind",
      "word_id": "en_idiom_a_change_of_mind",
      "pos": "idiom",
      "definition": "Idiomatic expression: 'A change of mind'",
      "example": "Example sentence using 'A change of mind'."
    },
    {
      "word": "Ups and downs",
      "word_id": "en_idiom_ups_and_downs",
      "pos": "idiom",
      "definition": "Idiomatic expression: 'Ups and downs'",
      "example": "Example sentence using 'Ups and downs'."
    },
    {
      "word": "Fair and square",
      "word_id": "en_idiom_fair_and_square",
      "pos": "idiom",
      "definition": "Idiomatic expression: 'Fair and square'",
      "example": "Example sentence using 'Fair and square'."
    },
    {
      "word": "Clean and tidy",
      "word_id": "en_idiom_clean_and_tidy",
      "pos": "idiom",
      "definition": "Idiomatic expression: 'Clean and tidy'",
      "example": "Example sentence using 'Clean and tidy'."
    },
    {
      "word": "More or less",
      "word_id": "en_idiom_more_or_less",
      "pos": "idiom",
      "definition": "Idiomatic expression: 'More or less'",
      "example": "Example sentence using 'More or less'."
    },
    {
      "word": "So-so",
      "word_id": "en_idiom_so_so",
      "pos": "idiom",
      "definition": "Idiomatic expression: 'So-so'",
      "example": "Example sentence using 'So-so'."
    },
    {
      "word": "Short and sweet",
      "word_id": "en_idiom_short_and_sweet",
      "pos": "idiom",
      "definition": "Idiomatic expression: 'Short and sweet'",
      "example": "Example sentence using 'Short and sweet'."
    },
    {
      "word": "Pros and cons",
      "word_id": "en_idiom_pros_and_cons",
      "pos": "idiom",
      "definition": "Idiomatic expression: 'Pros and cons'",
      "example": "Example sentence using 'Pros and cons'."
    },
    {
      "word": "Sooner than expected",
      "word_id": "en_idiom_sooner_than_expected",
      "pos": "idiom",
      "definition": "Idiomatic expression: 'Sooner than expected'",
      "example": "Example sentence using 'Sooner than expected'."
    },
    {
      "word": "Under the weather",
      "word_id": "en_idiom_under_the_weather",
      "pos": "idiom",
      "definition": "Feeling slightly unwell or sick.",
      "example": "I am feeling a bit under the weather today."
    },
    {
      "word": "Once in a blue moon",
      "word_id": "en_idiom_once_in_a_blue_moon",
      "pos": "idiom",
      "definition": "Very rarely or almost never.",
      "example": "He visits the museum once in a blue moon."
    },
    {
      "word": "Spill the beans",
      "word_id": "en_idiom_spill_the_beans",
      "pos": "idiom",
      "definition": "To reveal a secret unexpectedly.",
      "example": "Don't spill the beans about the surprise party!"
    },
    {
      "word": "Lend a hand",
      "word_id": "en_idiom_lend_a_hand",
      "pos": "idiom",
      "definition": "To help someone.",
      "example": "Could you lend me a hand with these heavy boxes?"
    },
    {
      "word": "In the same boat",
      "word_id": "en_idiom_in_the_same_boat",
      "pos": "idiom",
      "definition": "In the same difficult situation as others.",
      "example": "We are all in the same boat during these exams."
    },
    {
      "word": "See eye to eye",
      "word_id": "en_idiom_see_eye_to_eye",
      "pos": "idiom",
      "definition": "To agree with someone completely.",
      "example": "My brother and I do not always see eye to eye."
    },
    {
      "word": "Cost an arm and a leg",
      "word_id": "en_idiom_cost_an_arm_and_a_leg",
      "pos": "idiom",
      "definition": "To be extremely expensive.",
      "example": "Buying a brand new car can cost an arm and a leg."
    },
    {
      "word": "Rule of thumb",
      "word_id": "en_idiom_rule_of_thumb",
      "pos": "idiom",
      "definition": "A practical, approximate rule for doing something.",
      "example": "As a rule of thumb, review vocabulary every morning."
    },
    {
      "word": "Sleep on it",
      "word_id": "en_idiom_sleep_on_it",
      "pos": "idiom",
      "definition": "To delay making a decision until the next day.",
      "example": "Don't decide now; sleep on it and tell me tomorrow."
    },
    {
      "word": "Break the ice",
      "word_id": "en_idiom_break_the_ice",
      "pos": "idiom",
      "definition": "To make people feel more comfortable in a new situation.",